{
  "$schema": "https://lintai.dev/schema.json",
  "llm": {
    "provider": "ollama",
    "baseUrl": "http://localhost:11434",
    "model": "qwen2.5-coder:7b",
    "timeout": 60000,
    "maxTokens": 4096
  },
  "analysis": {
    "mode": "snippet",
    "includeImports": false,
    "maxFileSize": 100000
  },
  "rules": {
    "codeSmells": true,
    "badPractices": true,
    "spaghetti": true,
    "naming": true,
    "errorHandling": true,
    "anyAbuse": true
  },
  "severity": {
    "highConfidenceThreshold": 0.8,
    "mediumConfidenceThreshold": 0.5
  },
  "performance": {
    "debounceMs": 600,
    "rateLimitPerMinute": 100,
    "rateLimitEnabled": false
  },
  "debug": false
}
